<?xml version="1.0" encoding="UTF-8"?>
<tns:system_info xmlns:tns="http://alapps.avnet.com/ALAPPSResponseSchema"
	xmlns:xsi="http://www.w3.org/2001/XMLSchema-instance"
	xsi:schemaLocation="http://alapps.avnet.com/ALAPPSResponseSchema ALAPPSResponseSchema.xsd ">
	<chassis_info>
		<chassis_backplane_mcu_firmware_version>1.08
		</chassis_backplane_mcu_firmware_version>
		<chassis_hardware_version>1.02</chassis_hardware_version>
		<chassis_mfg_name>Supermicro</chassis_mfg_name>
		<chassis_mfg_part_number>CSE-217HQ+-R2K02BP</chassis_mfg_part_number>
		<chassis_nutanix_part_number>525-0037-0001</chassis_nutanix_part_number>
		<chassis_nutanix_serial_number>15SM60370014</chassis_nutanix_serial_number>
		<chassis_nutanix_top_level_part_number>P140-ABI-H143565</chassis_nutanix_top_level_part_number>
		<chassis_partnumber>SYS-2028TP-HC0R</chassis_partnumber>
		<chassis_serialnumber>C2170AE28N90375</chassis_serialnumber>
		<node_info>
			<node_location>D</node_location>
			<cpu_info>
				<cpu_core_count>10</cpu_core_count>
				<cpu_hardware_version>Intel(R) Xeon(R) CPU E5-2660 v3 @
					2.60GHz</cpu_hardware_version>
				<cpu_location>CPU2</cpu_location>
				<cpu_mfg_name>Intel</cpu_mfg_name>
				<cpu_mfg_part_number>CM8064401446117S R1XR
				</cpu_mfg_part_number>
				<cpu_nutanix_part_number>550-0018-0001
				</cpu_nutanix_part_number>
				<cpu_partnumber>CM8064401446117S R1XR
				</cpu_partnumber>
				<cpu_serialnumber>FAKE_CPU_SN_8</cpu_serialnumber>
				<cpu_speed>2600 MHz</cpu_speed>
				<test_results>
					<test_result>
						<test_id>32</test_id>
						<client>IST</client>
						<result_code>ABORT</result_code>
						<date>01-14-2016 4:27:06 PM MST</date>
					</test_result>
				</test_results>
				<extracted_values></extracted_values>
			</cpu_info>
			<cpu_info>
				<cpu_core_count>10</cpu_core_count>
				<cpu_hardware_version>Intel(R) Xeon(R) CPU E5-2660 v3 @
					2.60GHz</cpu_hardware_version>
				<cpu_location>CPU1</cpu_location>
				<cpu_mfg_name>Intel</cpu_mfg_name>
				<cpu_mfg_part_number>CM8064401446117S R1XR
				</cpu_mfg_part_number>
				<cpu_nutanix_part_number>550-0018-0001
				</cpu_nutanix_part_number>
				<cpu_partnumber>CM8064401446117S R1XR
				</cpu_partnumber>
				<cpu_serialnumber>FAKE_CPU_SN_7</cpu_serialnumber>
				<cpu_speed>2600 MHz</cpu_speed>
				<test_results></test_results>
				<extracted_values>
					<extracted_value>
						<test_id>32</test_id>
						<client>IST</client>
						<name>EXECHK_CPU_INFO</name>
						<description>CPU info check</description>
						<value>10</value>
						<date>01-14-2016 4:27:06 PM MST</date>
					</extracted_value>
					<extracted_value>
						<test_id>32</test_id>
						<client>IST</client>
						<name>EXECHK_CPU_INFO</name>
						<description>CPU info check</description>
						<value>Intel(R) Xeon(R) CPU E5-2660 v3 @ 2.60GHz</value>
						<date>01-14-2016 4:27:06 PM MST</date>
					</extracted_value>
					<extracted_value>
						<test_id>32</test_id>
						<client>IST</client>
						<name>EXECHK_CPU_INFO</name>
						<description>CPU info check</description>
						<value>Socket Designation: CPU2</value>
						<date>01-14-2016 4:27:06 PM MST</date>
					</extracted_value>
					<extracted_value>
						<test_id>32</test_id>
						<client>IST</client>
						<name>EXECHK_CPU_INFO</name>
						<description>CPU info check</description>
						<value>Intel</value>
						<date>01-14-2016 4:27:06 PM MST</date>
					</extracted_value>
					<extracted_value>
						<test_id>32</test_id>
						<client>IST</client>
						<name>EXECHK_CPU_INFO</name>
						<description>CPU info check</description>
						<value>Socket Designation: CPU1</value>
						<date>01-14-2016 4:27:06 PM MST</date>
					</extracted_value>
					<extracted_value>
						<test_id>32</test_id>
						<client>IST</client>
						<name>EXECHK_CPU_INFO</name>
						<description>CPU info check</description>
						<value>Intel(R) Xeon(R) CPU E5-2660 v3 @ 2.60GHz</value>
						<date>01-14-2016 4:27:06 PM MST</date>
					</extracted_value>
					<extracted_value>
						<test_id>32</test_id>
						<client>IST</client>
						<name>EXECHK_CPU_INFO</name>
						<description>CPU info check</description>
						<value>Xeon</value>
						<date>01-14-2016 4:27:06 PM MST</date>
					</extracted_value>
					<extracted_value>
						<test_id>32</test_id>
						<client>IST</client>
						<name>EXECHK_CPU_INFO</name>
						<description>CPU info check</description>
						<value>Xeon</value>
						<date>01-14-2016 4:27:06 PM MST</date>
					</extracted_value>
					<extracted_value>
						<test_id>32</test_id>
						<client>IST</client>
						<name>EXECHK_CPU_INFO</name>
						<description>CPU info check</description>
						<value>2600</value>
						<date>01-14-2016 4:27:06 PM MST</date>
					</extracted_value>
					<extracted_value>
						<test_id>32</test_id>
						<client>IST</client>
						<name>EXECHK_CPU_INFO</name>
						<description>CPU info check</description>
						<value>Intel</value>
						<date>01-14-2016 4:27:06 PM MST</date>
					</extracted_value>
					<extracted_value>
						<test_id>32</test_id>
						<client>IST</client>
						<name>EXECHK_CPU_INFO</name>
						<description>CPU info check</description>
						<value>10</value>
						<date>01-14-2016 4:27:06 PM MST</date>
					</extracted_value>
					<extracted_value>
						<test_id>32</test_id>
						<client>IST</client>
						<name>EXECHK_CPU_INFO</name>
						<description>CPU info check</description>
						<value>2600</value>
						<date>01-14-2016 4:27:06 PM MST</date>
					</extracted_value>
				</extracted_values>
			</cpu_info>
			<dimm_info>
				<memory_capacity>16384 MB</memory_capacity>
				<memory_data_rate>DDR4</memory_data_rate>
				<memory_location>P1-DIMMA2</memory_location>
				<memory_mfg_name>Samsung</memory_mfg_name>
				<memory_mfg_part_number>M393A2G40DB0-CPB
				</memory_mfg_part_number>
				<memory_nutanix_part_number>502-0011-0001
				</memory_nutanix_part_number>
				<memory_partnumber>M393A2G40DB0-CPB00
				</memory_partnumber>
				<memory_serialnumber>TESTONLY0040242631
				</memory_serialnumber>
				<memory_speed>2133 MHz</memory_speed>
				<test_results>
					<test_result>
						<test_id>32</test_id>
						<client>IST</client>
						<result_code>ABORT</result_code>
						<date>01-14-2016 4:27:06 PM MST</date>
					</test_result>
				</test_results>
				<extracted_values></extracted_values>
			</dimm_info>
			<dimm_info>
				<memory_capacity>16384 MB</memory_capacity>
				<memory_data_rate>DDR4</memory_data_rate>
				<memory_location>P1-DIMMB2</memory_location>
				<memory_mfg_name>Samsung</memory_mfg_name>
				<memory_mfg_part_number>M393A2G40DB0-CPB
				</memory_mfg_part_number>
				<memory_nutanix_part_number>502-0011-0001
				</memory_nutanix_part_number>
				<memory_partnumber>M393A2G40DB0-CPB00
				</memory_partnumber>
				<memory_serialnumber>TESTONLY0040242EBD
				</memory_serialnumber>
				<memory_speed>2133 MHz</memory_speed>
				<test_results>
					<test_result>
						<test_id>32</test_id>
						<client>IST</client>
						<result_code>ABORT</result_code>
						<date>01-14-2016 4:27:06 PM MST</date>
					</test_result>
				</test_results>
				<extracted_values></extracted_values>
			</dimm_info>
			<dimm_info>
				<memory_capacity>16384 MB</memory_capacity>
				<memory_data_rate>DDR4</memory_data_rate>
				<memory_location>P1-DIMMC1</memory_location>
				<memory_mfg_name>Samsung</memory_mfg_name>
				<memory_mfg_part_number>M393A2G40DB0-CPB
				</memory_mfg_part_number>
				<memory_nutanix_part_number>502-0011-0001
				</memory_nutanix_part_number>
				<memory_partnumber>M393A2G40DB0-CPB00
				</memory_partnumber>
				<memory_serialnumber>TESTONLY0040242E89
				</memory_serialnumber>
				<memory_speed>2133 MHz</memory_speed>
				<test_results>
					<test_result>
						<test_id>32</test_id>
						<client>IST</client>
						<result_code>ABORT</result_code>
						<date>01-14-2016 4:27:06 PM MST</date>
					</test_result>
				</test_results>
				<extracted_values></extracted_values>
			</dimm_info>
			<dimm_info>
				<memory_capacity>16384 MB</memory_capacity>
				<memory_data_rate>DDR4</memory_data_rate>
				<memory_location>P1-DIMMD1</memory_location>
				<memory_mfg_name>Samsung</memory_mfg_name>
				<memory_mfg_part_number>M393A2G40DB0-CPB
				</memory_mfg_part_number>
				<memory_nutanix_part_number>502-0011-0001
				</memory_nutanix_part_number>
				<memory_partnumber>M393A2G40DB0-CPB00
				</memory_partnumber>
				<memory_serialnumber>TESTONLY0040242E8D
				</memory_serialnumber>
				<memory_speed>2133 MHz</memory_speed>
				<test_results>
					<test_result>
						<test_id>32</test_id>
						<client>IST</client>
						<result_code>ABORT</result_code>
						<date>01-14-2016 4:27:06 PM MST</date>
					</test_result>
				</test_results>
				<extracted_values></extracted_values>
			</dimm_info>
			<dimm_info>
				<memory_capacity>16384 MB</memory_capacity>
				<memory_data_rate>DDR4</memory_data_rate>
				<memory_location>P2-DIMME1</memory_location>
				<memory_mfg_name>Samsung</memory_mfg_name>
				<memory_mfg_part_number>M393A2G40DB0-CPB
				</memory_mfg_part_number>
				<memory_nutanix_part_number>502-0011-0001
				</memory_nutanix_part_number>
				<memory_partnumber>M393A2G40DB0-CPB00
				</memory_partnumber>
				<memory_serialnumber>TESTONLY0040242607
				</memory_serialnumber>
				<memory_speed>2133 MHz</memory_speed>
				<test_results>
					<test_result>
						<test_id>32</test_id>
						<client>IST</client>
						<result_code>ABORT</result_code>
						<date>01-14-2016 4:27:06 PM MST</date>
					</test_result>
				</test_results>
				<extracted_values></extracted_values>
			</dimm_info>
			<dimm_info>
				<memory_capacity>16384 MB</memory_capacity>
				<memory_data_rate>DDR4</memory_data_rate>
				<memory_location>P2-DIMMH2</memory_location>
				<memory_mfg_name>Samsung</memory_mfg_name>
				<memory_mfg_part_number>M393A2G40DB0-CPB
				</memory_mfg_part_number>
				<memory_nutanix_part_number>502-0011-0001